{
  "schemaVersion": "1.0.0",
  "vectorVersion": "1.0.0",
  "domain": "riskPosition",
  "cases": [
    {
      "id": "risk-budget-binds",
      "category": "normal",
      "operation": "calculate",
      "input": {
        "availableQuote": "1000",
        "entryPrice": "100",
        "stopPrice": "90",
        "riskRate": "0.01",
        "feeRate": "0"
      },
      "expected": {
        "riskBudget": "10",
        "stopDistance": "10",
        "unitRisk": "10",
        "quantityByRisk": "1",
        "quantityByBalance": "10",
        "suggestedQuantity": "1",
        "notional": "100",
        "entryFee": "0",
        "totalCapital": "100",
        "bindingConstraint": "risk"
      }
    },
    {
      "id": "fees-reduce-position",
      "category": "normal",
      "operation": "calculate",
      "input": {
        "availableQuote": "1000",
        "entryPrice": "100",
        "stopPrice": "90",
        "riskRate": "0.01",
        "feeRate": "0.001"
      },
      "expected": {
        "riskBudget": "10",
        "stopDistance": "10",
        "unitRisk": "10.19",
        "quantityByRisk": "0.98135426889106967615",
        "quantityByBalance": "9.99000999000999001",
        "suggestedQuantity": "0.98135426889106967615",
        "notional": "98.135426889106967615",
        "entryFee": "0.098135426889106967615",
        "totalCapital": "98.233562315996074583",
        "bindingConstraint": "risk"
      }
    },
    {
      "id": "balance-cap-binds",
      "category": "normal",
      "operation": "calculate",
      "input": {
        "availableQuote": "1000",
        "entryPrice": "100",
        "stopPrice": "99",
        "riskRate": "1",
        "feeRate": "0.001"
      },
      "expected": {
        "riskBudget": "1000",
        "stopDistance": "1",
        "unitRisk": "1.199",
        "quantityByRisk": "834.02835696413678065",
        "quantityByBalance": "9.99000999000999001",
        "suggestedQuantity": "9.99000999000999001",
        "notional": "999.000999000999001",
        "entryFee": "0.999000999000999001",
        "totalCapital": "1000",
        "bindingConstraint": "balance"
      }
    },
    {
      "id": "zero-balance",
      "category": "boundary",
      "operation": "calculate",
      "input": {
        "availableQuote": "0",
        "entryPrice": "100",
        "stopPrice": "90",
        "riskRate": "0.01",
        "feeRate": "0.001"
      },
      "expected": {
        "riskBudget": "0",
        "stopDistance": "10",
        "unitRisk": "10.19",
        "quantityByRisk": "0",
        "quantityByBalance": "0",
        "suggestedQuantity": "0",
        "notional": "0",
        "entryFee": "0",
        "totalCapital": "0",
        "bindingConstraint": "balance"
      }
    },
    {
      "id": "extreme-small-price",
      "category": "boundary",
      "operation": "calculate",
      "input": {
        "availableQuote": "1",
        "entryPrice": "0.00000001",
        "stopPrice": "0.000000009",
        "riskRate": "0.01",
        "feeRate": "0"
      },
      "expected": {
        "riskBudget": "0.01",
        "stopDistance": "0.000000001",
        "unitRisk": "0.000000001",
        "quantityByRisk": "10000000",
        "quantityByBalance": "100000000",
        "suggestedQuantity": "10000000",
        "notional": "0.1",
        "entryFee": "0",
        "totalCapital": "0.1",
        "bindingConstraint": "risk"
      }
    },
    {
      "id": "reject-stop-at-entry",
      "category": "error",
      "operation": "calculate",
      "input": {
        "availableQuote": "1",
        "entryPrice": "100",
        "stopPrice": "100",
        "riskRate": "0.01",
        "feeRate": "0"
      },
      "errorPattern": "stop price"
    },
    {
      "id": "reject-zero-risk-rate",
      "category": "error",
      "operation": "calculate",
      "input": {
        "availableQuote": "1",
        "entryPrice": "100",
        "stopPrice": "90",
        "riskRate": "0",
        "feeRate": "0"
      },
      "errorPattern": "risk rate"
    }
  ]
}
